{
  "schema_version": 1,
  "discovery_id": "2026-08-03-backfill-60d",
  "profile_name": "default",
  "status": "completed",
  "strategy": "backfill",
  "previous_discovery_id": "2026-08-03-last-week",
  "started_at": "2026-08-03T10:33:30-07:00",
  "completed_at": "2026-08-03T10:56:59-07:00",
  "date_range": {
    "start": "2026-06-05",
    "end": "2026-08-03",
    "timezone": "America/Los_Angeles"
  },
  "query_matrix": [
    "\"AI Frontend Engineer\" \"San Francisco\"",
    "\"Frontend AI Engineer\" \"San Francisco\"",
    "\"AI Full-Stack Engineer\" \"San Francisco\"",
    "\"Full-Stack AI Engineer\" \"San Francisco\"",
    "\"AI Product Engineer\" \"San Francisco\"",
    "\"Frontend Engineer\" AI \"San Francisco\"",
    "\"Product Engineer\" AI \"San Francisco\"",
    "\"Full-Stack Engineer\" AI \"San Francisco\"",
    "\"Applied AI Engineer\" \"San Francisco\"",
    "\"Software Engineer\" \"AI Product\" \"San Francisco\"",
    "\"Senior Frontend Engineer\" AI \"San Francisco\"",
    "\"Senior Full Stack Engineer\" AI \"San Francisco\"",
    "\"Lead AI Frontend Engineer\" \"San Francisco\"",
    "\"Lead AI Product Engineer\" \"San Francisco\""
  ],
  "coverage": {
    "candidate_limit": 100,
    "limit_reached": false
  },
  "sources": [
    {
      "name": "Google Jobs",
      "kind": "job_board",
      "query": "AI product, frontend, and full-stack engineering in San Francisco",
      "url": "https://www.google.com/search?q=%28%22AI+Product+Engineer%22+OR+%22AI+Frontend+Engineer%22+OR+%22Full+Stack+Engineer%22%29+%22San+Francisco%22&udm=8",
      "status": "searched",
      "candidate_count": 10,
      "notes": "Searched first. Results included Gem, Klarity, Skiffra, Calvis, Town, and unresolved recruiter leads; remote and new-graduate-only results were filtered later."
    },
    {
      "name": "Google web search",
      "kind": "web_search",
      "query": "Full 14-query approved-title matrix for San Francisco",
      "url": "https://www.google.com/",
      "status": "searched",
      "candidate_count": 26,
      "notes": "Broad and site-specific searches surfaced official employer, ATS, and board pages. Search-engine crawl dates were not treated as employer posting dates."
    },
    {
      "name": "Wellfound",
      "kind": "job_board",
      "query": "AI product, frontend, applied AI, and full-stack roles in San Francisco",
      "url": "https://wellfound.com/role/l/ai-engineer/san-francisco-bay-area",
      "status": "searched",
      "candidate_count": 4,
      "notes": "Found Gem, Calvis, Samba TV, and other startup leads; Bay Area-only and remote roles required later filtering."
    },
    {
      "name": "Built In San Francisco",
      "kind": "job_board",
      "query": "AI frontend and AI product engineering in San Francisco",
      "url": "https://www.builtinsf.com/jobs/dev-engineering/front-end",
      "status": "searched",
      "candidate_count": 5,
      "notes": "Provided recent repost evidence for Speak, Town, Klarity, and Skiffra."
    },
    {
      "name": "LinkedIn",
      "kind": "job_board",
      "query": "AI Product Engineer and AI frontend roles in San Francisco",
      "url": "https://www.linkedin.com/jobs/search/?keywords=AI%20Product%20Engineer&location=San%20Francisco%2C%20California%2C%20United%20States",
      "status": "searched",
      "candidate_count": 4,
      "notes": "Useful for Harnham, Skiffra, Calvis, and lead-title discovery; canonical employer links were not always exposed."
    },
    {
      "name": "Indeed",
      "kind": "job_board",
      "query": "AI frontend, product, applied AI, and full-stack engineering in San Francisco",
      "url": "https://www.indeed.com/q-ai-product-engineer-l-san-francisco%2C-ca-jobs.html",
      "status": "searched",
      "candidate_count": 7,
      "notes": "Found Town, G2, Rippling, Tavrn, Deloitte, and other candidates; contract, remote, and below-range roles were filtered during verification."
    },
    {
      "name": "Employer-source registry",
      "kind": "employer_careers",
      "query": "All active employers in sources/employers.json",
      "url": null,
      "status": "searched",
      "candidate_count": 7,
      "notes": "Rechecked Speak, Retool, ReadMe, Retell AI, Klarity, and Samba TV, and preserved historical leads for re-evaluation."
    },
    {
      "name": "Employer career pages",
      "kind": "employer_careers",
      "query": "Canonical pages for discovered San Francisco candidates",
      "url": null,
      "status": "searched",
      "candidate_count": 12,
      "notes": "Confirmed official pages for OpenAI, Town, Rippling, Gem via YC, and ATS-hosted employers."
    },
    {
      "name": "Ashby",
      "kind": "ats",
      "query": "Active exact-title candidates and registry employers",
      "url": "https://jobs.ashbyhq.com/",
      "status": "searched",
      "candidate_count": 17,
      "notes": "Public posting APIs were used to verify listing status, employer dates, workplace type, location, and compensation where available."
    },
    {
      "name": "Greenhouse",
      "kind": "ats",
      "query": "San Francisco full-stack and AI product candidates",
      "url": "https://job-boards.greenhouse.io/",
      "status": "searched",
      "candidate_count": 1,
      "notes": "Komodo Health's prior Full-Stack AI Engineer URL now redirects to the board and the role is no longer listed."
    },
    {
      "name": "Lever",
      "kind": "ats",
      "query": "Active San Francisco AI Product Engineer candidates",
      "url": "https://jobs.lever.co/",
      "status": "searched",
      "candidate_count": 1,
      "notes": "Samba TV's canonical AI Product Engineer posting is active."
    },
    {
      "name": "Y Combinator Jobs",
      "kind": "job_board",
      "query": "AI Product Engineer San Francisco",
      "url": "https://www.ycombinator.com/jobs",
      "status": "searched",
      "candidate_count": 2,
      "notes": "Provided an active canonical application page for Gem and corroborating evidence for Speak."
    }
  ],
  "candidates": [
    {
      "candidate_key": "klarity-senior-ai-frontend-engineer-san-francisco",
      "title": "Senior AI Frontend Engineer",
      "company": "Klarity",
      "discovery_url": "https://www.jobleads.com/us/job/senior-ai-frontend-engineer-on-site-sf-equity--san-francisco--eaa965395bc20477bc638154a88f82a1f",
      "canonical_url": "https://jobs.ashbyhq.com/klarity-ai/05377ac4-4c57-4146-a077-4e84f7d6a273",
      "source_names": ["Google web search", "Built In San Francisco", "Ashby"],
      "location_text": "San Francisco (Klarity HQ)",
      "workplace_arrangement": "on-site",
      "compensation": {"minimum": 175000, "maximum": 275000, "currency": "USD", "basis": "base", "period": "year", "source_text": "$175K-$275K base plus equity."},
      "posted_date": null,
      "discovered_at": "2026-08-03T10:56:59-07:00",
      "preliminary_fit": ["Exact senior AI frontend title", "React, Next.js, TypeScript, and product design", "Series B", "Explicitly does not require a CS or engineering degree"],
      "preliminary_concerns": ["Employer date is 2026-04-08, while a board shows a recent repost", "Base range begins below $200,000"],
      "verification": {"status": "verified", "run_id": "2026-08-03-backfill-verify-1", "reason": "Active canonical role; recent repost evidence falls within the backfill window.", "verified_at": "2026-08-03T10:58:30-07:00"}
    },
    {
      "candidate_key": "gem-ai-product-engineer-san-francisco",
      "title": "AI Product Engineer (San Francisco)",
      "company": "Gem",
      "discovery_url": "https://www.google.com/search?q=%22AI+Product+Engineer%22+%22San+Francisco%22&udm=8",
      "canonical_url": "https://www.ycombinator.com/companies/gem/jobs/4Uathaz-ai-product-engineer-san-francisco",
      "source_names": ["Google Jobs", "Wellfound", "Y Combinator Jobs"],
      "location_text": "San Francisco, CA; based at the San Francisco HQ and not eligible for full-time remote work",
      "workplace_arrangement": "on-site",
      "compensation": {"minimum": 150000, "maximum": 260000, "currency": "USD", "basis": "base", "period": "year", "source_text": "$150,000-$260,000 annual salary plus equity and benefits."},
      "posted_date": null,
      "discovered_at": "2026-08-03T10:56:59-07:00",
      "preliminary_fit": ["Exact AI Product Engineer title", "Full-stack user-facing AI features", "Python, Node, TypeScript, and React", "Three or more years of experience and no degree requirement"],
      "preliminary_concerns": ["Posting date is unknown", "Base range begins below $200,000"],
      "verification": {"status": "verified", "run_id": "2026-08-03-backfill-verify-1", "reason": "Active canonical YC company posting with confirmed San Francisco HQ work and full-time status.", "verified_at": "2026-08-03T10:58:30-07:00"}
    },
    {
      "candidate_key": "speak-ai-product-engineer-san-francisco",
      "title": "AI Product Engineer",
      "company": "Speak",
      "discovery_url": "https://www.builtinsf.com/job/ai-product-engineer/4468709",
      "canonical_url": "https://jobs.ashbyhq.com/speak/e91eb4bc-93bf-4e3a-b7c9-4a2f506df43f",
      "source_names": ["Built In San Francisco", "Ashby", "Y Combinator Jobs"],
      "location_text": "San Francisco, CA",
      "workplace_arrangement": "hybrid",
      "compensation": {"minimum": 150000, "maximum": 280000, "currency": "USD", "basis": "base", "period": "year", "source_text": "$150K-$280K base plus equity."},
      "posted_date": "2026-08-02",
      "discovered_at": "2026-08-03T10:56:59-07:00",
      "preliminary_fit": ["Exact title", "React, Node, TypeScript, and Python", "Product and design collaboration", "Series C"],
      "preliminary_concerns": ["August 2 is a repost date; the employer record originated earlier", "Base range begins below $200,000"],